{
  "implementation_id": "rapidjson-24b5e7a8-coarse-cpp-dom",
  "display_name": "RapidJSON 24b5e7a8 DOM",
  "source_id": "rapidjson",
  "source_revision": "24b5e7a8b27f42fa16b96fc70aade9106cf7102f",
  "boundary": {
    "kind": "coarse_cpp",
    "reason": "RapidJSON's GenericDocument parser and traversal API are C++; one extern C call translates the completed observation into a fixed-width record.",
    "retains_input": false,
    "hidden_io": false,
    "abi_test": "test.sh checks C and Ada layout, symbols, nullability, ownership, arbitrary Ada bounds, strictness, and failure publication."
  },
  "build_tracks": {
    "portable": {
      "supported": true,
      "reason": "C++17 with -O3 and no host-specific ISA compile flag."
    },
    "native": {
      "supported": true,
      "reason": "The portable flags add -mcpu=native on arm64/aarch64 and -march=native elsewhere."
    }
  },
  "lanes": [
    {
      "lane": "parse_validate",
      "supported": false,
      "api": "not exposed by this adapter",
      "profile_ids": [],
      "output_policy_ids": [],
      "observable_result": "not available",
      "limitations": ["The admitted call constructs and recursively traverses a DOM."]
    },
    {
      "lane": "parse_events",
      "supported": false,
      "api": "not exposed by this adapter",
      "profile_ids": [],
      "output_policy_ids": [],
      "observable_result": "not available",
      "limitations": ["The adapter deliberately uses the ordinary owned DOM API rather than presenting DOM traversal as a streaming event API."]
    },
    {
      "lane": "parse_incremental",
      "supported": false,
      "api": "not exposed by this adapter",
      "profile_ids": [],
      "output_policy_ids": [],
      "observable_result": "not available",
      "limitations": ["RapidJSON receives one complete contiguous input without adapter concatenation."]
    },
    {
      "lane": "parse_dom",
      "supported": true,
      "api": "flyology_json_bench_rapidjson_dom uses GenericDocument::Parse with kParseValidateEncodingFlag and recursively visits every DOM value.",
      "profile_ids": ["rapidjson-dom-validate-encoding-24b5e7a8"],
      "output_policy_ids": [],
      "observable_result": "Checksum over decoded strings, names, value kinds, and container counts plus event, scalar, member-name, and exact input-byte counters.",
      "limitations": [
        "DOM allocation, string copying, number conversion, recursive traversal, and per-call cleanup are timed.",
        "The adapter does not expose number lexemes or error offsets.",
        "An initial UTF-8 BOM is accepted and ignored, so BOM fixtures are profile-disagreement evidence rather than primary throughput inputs."
      ]
    },
    {
      "lane": "write_stream",
      "supported": false,
      "api": "not exposed by this adapter",
      "profile_ids": [],
      "output_policy_ids": [],
      "observable_result": "not available",
      "limitations": ["No RapidJSON writer boundary is included."]
    },
    {
      "lane": "write_dom",
      "supported": false,
      "api": "not exposed by this adapter",
      "profile_ids": [],
      "output_policy_ids": [],
      "observable_result": "not available",
      "limitations": ["No RapidJSON writer boundary is included."]
    },
    {
      "lane": "parse_write",
      "supported": false,
      "api": "not exposed by this adapter",
      "profile_ids": [],
      "output_policy_ids": [],
      "observable_result": "not available",
      "limitations": ["No combined parse-and-write boundary is included."]
    }
  ],
  "profiles": [
    {
      "profile_id": "rapidjson-dom-validate-encoding-24b5e7a8",
      "top_level_scalars": true,
      "bom": "ignore",
      "malformed_utf8": "reject",
      "unpaired_surrogates": "reject",
      "duplicate_names": "preserve_all",
      "comments": false,
      "trailing_commas": false,
      "raw_controls": false,
      "nonstandard_numbers": false,
      "nonfinite_numbers": false,
      "number_handling": "lossy_conversion",
      "maximum_depth": null,
      "other_limits": [
        "Input and DOM size are bounded by size_t, address space, and available allocation.",
        "A zero-length document is rejected.",
        "No explicit depth ceiling is configured; RapidJSON and the adapter consume allocator and native-stack resources."
      ]
    }
  ],
  "output_policies": [],
  "memory": {
    "input_access": "read_only",
    "required_readable_padding_octets": 0,
    "required_writable_padding_octets": 0,
    "copy_policy": "none",
    "allocation_reporting": "unavailable",
    "peak_memory_reporting": "process_rss"
  }
}
